{
  "capabilityId": "contract-security-fixture",
  "commitSha": "af8170fcdb9ce8a3817b5f2121608240a34ec519",
  "platform": "Windows 11 x64",
  "python": "3.12.10",
  "dependencies": {"a2a-sdk": "1.1.1", "jsonschema": "4.26.0", "mcp": "1.28.1"},
  "command": "python -m unittest discover -s tests -v",
  "startedAt": "2026-07-19T10:00:00Z",
  "finishedAt": "2026-07-19T10:01:00Z",
  "verificationLevel": "integration",
  "result": "pass",
  "scenarioIds": ["note-write-crash", "idempotency-conflict"],
  "sanitizationStatus": "synthetic",
  "openGaps": []
}
